{
  "$schema": "../../schemas/layout.schema.json",
  "formatVersion": 1,
  "canvas": {
    "width": 212,
    "height": 520,
    "clip": "pill"
  },
  "assets": {
    "digitSets": {}
  },
  "normal": {
    "background": "#000000",
    "widgets": [
      {
        "id": "odyssey",
        "label": "Odyssey trailer loop",
        "type": "animation",
        "frames": [
          "assets/anim/ody-000.png",
          "assets/anim/ody-001.png",
          "assets/anim/ody-002.png",
          "assets/anim/ody-003.png",
          "assets/anim/ody-004.png",
          "assets/anim/ody-005.png",
          "assets/anim/ody-006.png",
          "assets/anim/ody-007.png",
          "assets/anim/ody-008.png",
          "assets/anim/ody-009.png",
          "assets/anim/ody-010.png",
          "assets/anim/ody-011.png",
          "assets/anim/ody-012.png",
          "assets/anim/ody-013.png",
          "assets/anim/ody-014.png",
          "assets/anim/ody-015.png",
          "assets/anim/ody-016.png",
          "assets/anim/ody-017.png",
          "assets/anim/ody-018.png",
          "assets/anim/ody-019.png",
          "assets/anim/ody-020.png",
          "assets/anim/ody-021.png",
          "assets/anim/ody-022.png",
          "assets/anim/ody-023.png",
          "assets/anim/ody-024.png",
          "assets/anim/ody-025.png",
          "assets/anim/ody-026.png",
          "assets/anim/ody-027.png",
          "assets/anim/ody-028.png",
          "assets/anim/ody-029.png",
          "assets/anim/ody-030.png",
          "assets/anim/ody-031.png",
          "assets/anim/ody-032.png",
          "assets/anim/ody-033.png",
          "assets/anim/ody-034.png",
          "assets/anim/ody-035.png",
          "assets/anim/ody-036.png",
          "assets/anim/ody-037.png",
          "assets/anim/ody-038.png",
          "assets/anim/ody-039.png",
          "assets/anim/ody-040.png",
          "assets/anim/ody-041.png",
          "assets/anim/ody-042.png",
          "assets/anim/ody-043.png",
          "assets/anim/ody-044.png",
          "assets/anim/ody-045.png",
          "assets/anim/ody-046.png",
          "assets/anim/ody-047.png",
          "assets/anim/ody-048.png",
          "assets/anim/ody-049.png",
          "assets/anim/ody-050.png",
          "assets/anim/ody-051.png",
          "assets/anim/ody-052.png",
          "assets/anim/ody-053.png",
          "assets/anim/ody-054.png",
          "assets/anim/ody-055.png",
          "assets/anim/ody-056.png",
          "assets/anim/ody-057.png",
          "assets/anim/ody-058.png",
          "assets/anim/ody-059.png",
          "assets/anim/ody-060.png",
          "assets/anim/ody-061.png",
          "assets/anim/ody-062.png",
          "assets/anim/ody-063.png",
          "assets/anim/ody-064.png",
          "assets/anim/ody-065.png",
          "assets/anim/ody-066.png",
          "assets/anim/ody-067.png",
          "assets/anim/ody-068.png",
          "assets/anim/ody-069.png",
          "assets/anim/ody-070.png",
          "assets/anim/ody-071.png",
          "assets/anim/ody-072.png",
          "assets/anim/ody-073.png",
          "assets/anim/ody-074.png",
          "assets/anim/ody-075.png",
          "assets/anim/ody-076.png",
          "assets/anim/ody-077.png",
          "assets/anim/ody-078.png",
          "assets/anim/ody-079.png",
          "assets/anim/ody-080.png",
          "assets/anim/ody-081.png",
          "assets/anim/ody-082.png",
          "assets/anim/ody-083.png",
          "assets/anim/ody-084.png",
          "assets/anim/ody-085.png",
          "assets/anim/ody-086.png",
          "assets/anim/ody-087.png",
          "assets/anim/ody-088.png",
          "assets/anim/ody-089.png",
          "assets/anim/ody-090.png",
          "assets/anim/ody-091.png",
          "assets/anim/ody-092.png",
          "assets/anim/ody-093.png",
          "assets/anim/ody-094.png",
          "assets/anim/ody-095.png",
          "assets/anim/ody-096.png",
          "assets/anim/ody-097.png",
          "assets/anim/ody-098.png",
          "assets/anim/ody-099.png",
          "assets/anim/ody-100.png",
          "assets/anim/ody-101.png",
          "assets/anim/ody-102.png",
          "assets/anim/ody-103.png",
          "assets/anim/ody-104.png",
          "assets/anim/ody-105.png",
          "assets/anim/ody-106.png",
          "assets/anim/ody-107.png",
          "assets/anim/ody-108.png",
          "assets/anim/ody-109.png",
          "assets/anim/ody-110.png",
          "assets/anim/ody-111.png",
          "assets/anim/ody-112.png",
          "assets/anim/ody-113.png",
          "assets/anim/ody-114.png",
          "assets/anim/ody-115.png",
          "assets/anim/ody-116.png",
          "assets/anim/ody-117.png",
          "assets/anim/ody-118.png",
          "assets/anim/ody-119.png",
          "assets/anim/ody-120.png",
          "assets/anim/ody-121.png",
          "assets/anim/ody-122.png",
          "assets/anim/ody-123.png",
          "assets/anim/ody-124.png",
          "assets/anim/ody-125.png",
          "assets/anim/ody-126.png",
          "assets/anim/ody-127.png",
          "assets/anim/ody-128.png",
          "assets/anim/ody-129.png",
          "assets/anim/ody-130.png",
          "assets/anim/ody-131.png",
          "assets/anim/ody-132.png",
          "assets/anim/ody-133.png",
          "assets/anim/ody-134.png",
          "assets/anim/ody-135.png",
          "assets/anim/ody-136.png",
          "assets/anim/ody-137.png",
          "assets/anim/ody-138.png",
          "assets/anim/ody-139.png",
          "assets/anim/ody-140.png",
          "assets/anim/ody-141.png",
          "assets/anim/ody-142.png",
          "assets/anim/ody-143.png",
          "assets/anim/ody-144.png",
          "assets/anim/ody-145.png",
          "assets/anim/ody-146.png",
          "assets/anim/ody-147.png",
          "assets/anim/ody-148.png",
          "assets/anim/ody-149.png"
        ],
        "intervalMs": 67,
        "repeat": 0,
        "x": 0,
        "y": 0,
        "z": 0,
        "locked": true
      }
    ]
  },
  "aod": {
    "enabled": true,
    "background": "#000000",
    "widgets": [
      {
        "id": "aod-still",
        "label": "AOD still frame",
        "type": "image",
        "asset": "assets/anim/ody-075.png",
        "opacity": 0.4,
        "x": 0,
        "y": 0,
        "z": 0,
        "locked": true
      }
    ]
  }
}
