{
  "$schema": "../../schemas/layout.schema.json",
  "formatVersion": 1,
  "canvas": {
    "width": 212,
    "height": 520,
    "clip": "pill"
  },
  "assets": {
    "digitSets": {
      "large": {
        "digits": [
          "assets/digits-large/0.svg",
          "assets/digits-large/1.svg",
          "assets/digits-large/2.svg",
          "assets/digits-large/3.svg",
          "assets/digits-large/4.svg",
          "assets/digits-large/5.svg",
          "assets/digits-large/6.svg",
          "assets/digits-large/7.svg",
          "assets/digits-large/8.svg",
          "assets/digits-large/9.svg"
        ],
        "minus": "assets/digits-large/minus.svg"
      },
      "small": {
        "digits": [
          "assets/digits-small/0.svg",
          "assets/digits-small/1.svg",
          "assets/digits-small/2.svg",
          "assets/digits-small/3.svg",
          "assets/digits-small/4.svg",
          "assets/digits-small/5.svg",
          "assets/digits-small/6.svg",
          "assets/digits-small/7.svg",
          "assets/digits-small/8.svg",
          "assets/digits-small/9.svg"
        ],
        "minus": "assets/digits-small/minus.svg"
      }
    }
  },
  "normal": {
    "background": "#000000",
    "widgets": [
      {
        "id": "battery-icon-only-low",
        "label": "Battery icon only low",
        "type": "image-list",
        "source": "battery",
        "fallback": "floor",
        "items": [
          { "value": 0, "asset": "assets/battery_only_low/0.svg" },
          { "value": 5, "asset": "assets/battery_only_low/10.svg" },
          { "value": 10, "asset": "assets/battery_only_low/20.svg" },
          { "value": 20, "asset": "assets/battery_only_low/30.svg" }
        ],
        "x": 92,
        "y": 35,
        "z": 1
      },
      {
        "id": "hours",
        "x": 106,
        "y": 65,
        "z": 3,
        "label": "Hours",
        "type": "number",
        "source": "hour",
        "digitSet": "large",
        "digits": 2,
        "align": "center",
        "spacing": 4,
        "leadingZero": true,
        "locked": true
      },
      {
        "id": "minutes",
        "x": 106,
        "y": 190,
        "z": 4,
        "label": "Minutes",
        "type": "number",
        "source": "minute",
        "digitSet": "large",
        "digits": 2,
        "align": "center",
        "spacing": 4,
        "leadingZero": true,
        "locked": true
      },
      {
        "id": "weekday",
        "label": "Week day",
        "type": "image-list",
        "source": "weekday",
        "fallback": "floor",
        "items": [
          { "value": 0, "asset": "assets/weekdays/Sun.svg" },
          { "value": 1, "asset": "assets/weekdays/Mon.svg" },
          { "value": 2, "asset": "assets/weekdays/Tue.svg" },
          { "value": 3, "asset": "assets/weekdays/Wed.svg" },
          { "value": 4, "asset": "assets/weekdays/Thu.svg" },
          { "value": 5, "asset": "assets/weekdays/Fri.svg" },
          { "value": 6, "asset": "assets/weekdays/Sat.svg" }
        ],
        "x": 31,
        "y": 313,
        "z": 1
      },
      {
        "id": "day",
        "x": 111,
        "y": 320,
        "z": 3,
        "label": "Day",
        "type": "number",
        "source": "day",
        "digitSet": "small",
        "digits": 2,
        "align": "center",
        "spacing": 4,
        "leadingZero": true
      },
      {
        "id": "dot-day",
        "x": 130,
        "y": 334,
        "z": 5,
        "opacity": 1,
        "type": "image",
        "asset": "assets/weekdays/dot.svg"
      },
      {
        "id": "month",
        "x": 156,
        "y": 320,
        "z": 4,
        "label": "Month",
        "type": "number",
        "source": "month",
        "digitSet": "small",
        "digits": 2,
        "align": "center",
        "spacing": 4,
        "leadingZero": true
      },
      {
        "id": "dot-month",
        "x": 174,
        "y": 334,
        "z": 5,
        "opacity": 1,
        "type": "image",
        "asset": "assets/weekdays/dot.svg"
      },
      {
        "id": "steps-circle",
        "label": "Steps circle",
        "type": "image-list",
        "source": "stepProgress",
        "fallback": "floor",
        "items": [
          { "value": 0, "asset": "assets/steps-progress/0.svg" },
          { "value": 5, "asset": "assets/steps-progress/5.svg" },
          { "value": 10, "asset": "assets/steps-progress/10.svg" },
          { "value": 15, "asset": "assets/steps-progress/15.svg" },
          { "value": 20, "asset": "assets/steps-progress/20.svg" },
          { "value": 25, "asset": "assets/steps-progress/25.svg" },
          { "value": 30, "asset": "assets/steps-progress/30.svg" },
          { "value": 35, "asset": "assets/steps-progress/35.svg" },
          { "value": 40, "asset": "assets/steps-progress/40.svg" },
          { "value": 45, "asset": "assets/steps-progress/45.svg" },
          { "value": 50, "asset": "assets/steps-progress/50.svg" },
          { "value": 55, "asset": "assets/steps-progress/55.svg" },
          { "value": 60, "asset": "assets/steps-progress/60.svg" },
          { "value": 65, "asset": "assets/steps-progress/65.svg" },
          { "value": 70, "asset": "assets/steps-progress/70.svg" },
          { "value": 75, "asset": "assets/steps-progress/75.svg" },
          { "value": 80, "asset": "assets/steps-progress/80.svg" },
          { "value": 85, "asset": "assets/steps-progress/85.svg" },
          { "value": 90, "asset": "assets/steps-progress/90.svg" },
          { "value": 95, "asset": "assets/steps-progress/95.svg" },
          { "value": 100, "asset": "assets/steps-progress/100.svg" }
        ],
        "x": 31,
        "y": 360,
        "z": 1
      },
      {
        "id": "steps",
        "x": 106,
        "y": 425,
        "z": 6,
        "opacity": 1,
        "type": "number",
        "source": "steps",
        "digitSet": "small",
        "digits": 5,
        "align": "center",
        "spacing": 1,
        "leadingZero": true
      }
    ]
  },
  "aod": {
    "background": "#000000",
    "widgets": [],
    "enabled": false
  }
}
